{
  "schema_version": "capture.v1",
  "capture_id": "capture-1",
  "device_ref": "fixture:mic",
  "device_version": "fixture-driver",
  "asr_adapter_ref": "fixture:asr",
  "model_digest": null,
  "physical_activation_ref": "fixture:hotkey-event",
  "audio_ref": null,
  "segments": [],
  "state": "CAPTURING",
  "retention_policy_ref": "fixture:policy",
  "transcript_revision_refs": []
}
